{
  "schema_version": "1.0.0",
  "run_id": "RUN-SND-TEMPLATE",
  "session_id": "SES-TEMPLATE",
  "protocol_branch": "sound_key",
  "protocol_version": "1.0.0",
  "hypothesis_ids": [
    "H-02",
    "H-11",
    "H-12",
    "H-14"
  ],
  "timestamp": "2026-07-14T00:00:00Z",
  "operator_id": "OP-01",
  "control_role": "active",
  "randomization": {
    "seed": 20260714,
    "scheme": "condition order drawn from seeded RNG before session",
    "blinded": true,
    "blind_code": "COND-X"
  },
  "specimen": {
    "specimen_id": "SP-Q154-001",
    "specimen_type": "quartz_crystal",
    "material": {
      "name": "alpha-quartz",
      "density_g_cm3": 2.65,
      "density_source": "handbook (pin per D-19)"
    },
    "geometry": {
      "length_mm": 154.1,
      "diameter_wide_mm": 34.0,
      "diameter_narrow_mm": 25.0,
      "diameter_mode": "across_vertices",
      "facet_count": 6,
      "angle_female_deg": 51.843,
      "angle_male_deg": 60.0,
      "angle_mode": "face_slope",
      "measurement_uncertainty_mm": 0.05
    },
    "ladder": {
      "target_harmonic_N": 5,
      "target_length_mm": 154.052734375,
      "base_frequency_f0_hz": 4096
    },
    "mass_measured_g": 153.2,
    "orientation": {
      "crystallographic_axis_known": false,
      "axis_note": "u_v = 0.05 applies (RGCS-M.10)"
    },
    "provenance": {
      "origin": "TEMPLATE - replace with real specimen record",
      "classification_note": "angles and f0 = 4096 Hz are Source claims (RG-01, RG-16)"
    }
  },
  "environment": {
    "bench_id": "BENCH-A",
    "fixture_id": "FIX-VBLOCK-03",
    "timestamp_start": "2026-07-14T00:00:00Z",
    "temperature_c_start": 21.0,
    "humidity_pct": 45,
    "ambient_acoustic_dba": 38.0,
    "instrument_phase_drift_deg": 0.0,
    "notes": "TEMPLATE - fill measured values; phase-drift budget required before phase claims (KOS-13)."
  },
  "provenance": {
    "software": {
      "acquisition": "FILL",
      "rgcs_core": "FILL"
    },
    "git_commit": "FILL",
    "synthetic": false
  },
  "classification_note": "All preset drive values are Source claims (RG-12/RG-13/RG-14); this template asserts no result.",
  "notes": "TEMPLATE for docs/EXPERIMENT_PROTOCOL.md branch - copy, fill measured values, recompute sha256 hashes.",
  "drive_config": {
    "drive_id": "DRV-SND-1496",
    "branch": "sound_key",
    "drive_type": "acoustic_speaker",
    "sound_key": {
      "key_frequency_hz": 1496,
      "on_s": 3,
      "off_s": 3,
      "bursts": 4,
      "final_pause_s": 12,
      "spl_at_specimen_dba": 74.0,
      "speaker_distance_mm": 150,
      "coupling": "non_contact_speaker"
    },
    "energy": {
      "estimation_method": "SPL + exposure time at specimen",
      "matched_energy_group_id": "MEG-TEMPLATE"
    },
    "timing": {
      "session_duration_s": 36,
      "drive_off_time_s": 24
    },
    "reference_clock": {
      "shared": true,
      "source": "house 10 MHz reference"
    },
    "source_claim_refs": [
      "RG-13",
      "JH-013"
    ],
    "notes": "Alternate keys 644/587 Hz and matched-SPL off-frequency controls use the same template."
  },
  "acquisition": {
    "acquisition_id": "ACQ-SND-TEMPLATE",
    "sample_rate_hz": 65536,
    "duration_s": 90,
    "n_samples": 5898240,
    "single_shot": true,
    "n_runs": 100,
    "post_drive": {
      "drive_off_time_s": 24,
      "post_drive_ratio": 2.75
    },
    "channels": [
      {
        "channel_id": "CH1",
        "sensor_type": "accelerometer",
        "units": "m/s2",
        "position_xyz_mm": [
          40.0,
          18.0,
          0.0
        ],
        "calibration_ref": "CAL-TEMPLATE",
        "aperture_mm": 8.0,
        "sensor_mass_g": 0.8
      },
      {
        "channel_id": "CH2",
        "sensor_type": "microphone",
        "units": "Pa",
        "position_xyz_mm": [
          77.0,
          150.0,
          0.0
        ],
        "calibration_ref": "CAL-TEMPLATE",
        "aperture_mm": 12.0,
        "orientation_note": "reference mic at specimen position for SPL matching"
      }
    ],
    "artifact_register_ref": "campaigns/TEMPLATE/artifact_register.md",
    "iq": {
      "enabled": true,
      "lo_frequency_hz": 1496,
      "lo_derivation": "drive TCXO chain / house 10 MHz",
      "demodulation": "lock_in",
      "shared_reference": true,
      "reference_source": "house 10 MHz reference"
    }
  },
  "timeseries": [
    {
      "file": "data/RUN-SND-TEMPLATE_shot000.csv",
      "format": "csv",
      "sha256": "0000000000000000000000000000000000000000000000000000000000000000",
      "channel_ids": [
        "CH1",
        "CH2"
      ],
      "run_index": 0,
      "sample_rate_hz": 65536,
      "t0_s": 0.0,
      "n_rows": 5898240,
      "columns": [
        {
          "name": "t_s",
          "units": "s",
          "description": "time"
        },
        {
          "name": "accel_m_s2",
          "units": "m/s2",
          "description": "specimen response"
        },
        {
          "name": "mic_pa",
          "units": "Pa",
          "description": "reference SPL"
        }
      ],
      "notes": "TEMPLATE placeholder - sha256 must be the real file hash."
    }
  ]
}
